{"$schema":"https://json-schema.org/draft/2020-12/schema","type":"object","additionalProperties":false,"required":["batch_id","input_intake_ids","audits","verdict","next_permitted_action"],"properties":{"batch_id":{"type":"string","pattern":"^system-one-batch-"},"input_intake_ids":{"type":"array","minItems":3,"maxItems":3,"uniqueItems":true,"items":{"type":"string","pattern":"^intake-"}},"audits":{"type":"array","minItems":3,"maxItems":3,"items":{"type":"object","additionalProperties":false,"required":["intake_id","disposition","failed_gate","evidence","reason"],"properties":{"intake_id":{"type":"string","pattern":"^intake-"},"disposition":{"const":"rejected-before-cell"},"failed_gate":{"enum":["actual-data-fit","prior-art","nontrivial-consequence","decisive-test","bounded-expertise"]},"evidence":{"type":"array","minItems":1,"items":{"type":"object","additionalProperties":false,"required":["url","location","finding"],"properties":{"url":{"type":"string","format":"uri"},"location":{"type":"string","minLength":5},"finding":{"type":"string","minLength":30}}}},"reason":{"type":"string","minLength":40}}}},"verdict":{"const":"no-justified-trio"},"next_permitted_action":{"type":"string","minLength":30}}}
